[
  {
    "schema_version": "observation_ledger.gold.v1",
    "case_id": "obs-gd-001",
    "semantic_expectations": {
      "preferred_primary_label": "goal",
      "label_rationale": "The user explicitly states a bounded desired outcome and deadline; the agent preserves it as a goal rather than reporting completion.",
      "acceptable_facets": [
        {
          "kind": "custom",
          "value": {
            "name": "goal_outcome",
            "text": "launch the pilot to five clinics"
          },
          "evidence_refs": [
            "ev-001-user"
          ]
        },
        {
          "kind": "custom",
          "value": {
            "name": "target_date",
            "text": "October 1"
          },
          "evidence_refs": [
            "ev-001-user"
          ]
        }
      ],
      "forbidden_facets": [],
      "required_summary_meanings": [
        "The user stated a goal to launch the pilot to five clinics by October 1.",
        "The agent said the launch should not be treated as completed."
      ],
      "retrieval_eligible": true,
      "assertion_expectation": {
        "required": false,
        "empty_is_valid": true,
        "supported_if_authored": [
          "The user has a stated goal to launch the pilot to five clinics by October 1."
        ]
      },
      "associations_expected": [],
      "revisions_expected": [],
      "required_limitations": [
        "The year and timezone for October 1 are not stated."
      ]
    },
    "acceptable_labels": [
      "goal"
    ],
    "supported_propositions": [
      "The user stated a pilot-launch goal covering five clinics.",
      "The goal has an October 1 deadline.",
      "The agent did not claim the launch was complete."
    ],
    "forbidden_propositions": [
      "The pilot launched to five clinics.",
      "October 1 includes an unstated year or timezone.",
      "Five clinics agreed to participate."
    ],
    "evidence_spans": [
      {
        "evidence_id": "ev-001-user",
        "source_event_id": "event-gd-001",
        "start": 6,
        "end": 67,
        "quote": "Our goal is to launch the pilot to five clinics by October 1."
      },
      {
        "evidence_id": "ev-001-agent",
        "source_event_id": "event-gd-001",
        "start": 75,
        "end": 146,
        "quote": "I will record that as the stated pilot goal, not as a completed launch."
      }
    ]
  },
  {
    "schema_version": "observation_ledger.gold.v1",
    "case_id": "obs-gd-002",
    "semantic_expectations": {
      "preferred_primary_label": "goal",
      "label_rationale": "The user supplies a desired measurable release outcome and test condition, while the agent explicitly distinguishes the target from achieved performance.",
      "acceptable_facets": [
        {
          "kind": "custom",
          "value": {
            "name": "metric",
            "text": "p95 latency below 200 milliseconds"
          },
          "evidence_refs": [
            "ev-002-user"
          ]
        },
        {
          "kind": "custom",
          "value": {
            "name": "condition",
            "text": "documented load test"
          },
          "evidence_refs": [
            "ev-002-user"
          ]
        }
      ],
      "forbidden_facets": [],
      "required_summary_meanings": [
        "The user set a performance goal of p95 latency below 200 milliseconds under the documented load test.",
        "The agent said the event does not establish that the target is already met."
      ],
      "retrieval_eligible": true,
      "assertion_expectation": {
        "required": false,
        "empty_is_valid": true,
        "supported_if_authored": [
          "The next release has a stated p95 latency goal below 200 milliseconds under the documented load test."
        ]
      },
      "associations_expected": [],
      "revisions_expected": [],
      "required_limitations": [
        "No current measurement or load-test result is supplied."
      ]
    },
    "acceptable_labels": [
      "goal"
    ],
    "supported_propositions": [
      "The user stated a measurable latency goal for the next release.",
      "The goal applies under the documented load test."
    ],
    "forbidden_propositions": [
      "Current p95 latency is below 200 milliseconds.",
      "The release passed its load test.",
      "The load-test procedure is supplied in this event."
    ],
    "evidence_spans": [
      {
        "evidence_id": "ev-002-user",
        "source_event_id": "event-gd-002",
        "start": 6,
        "end": 104,
        "quote": "I want the next release to keep p95 latency below 200 milliseconds under the documented load test."
      },
      {
        "evidence_id": "ev-002-agent",
        "source_event_id": "event-gd-002",
        "start": 112,
        "end": 207,
        "quote": "That gives us a measurable performance goal; it does not show that the target is currently met."
      }
    ]
  },
  {
    "schema_version": "observation_ledger.gold.v1",
    "case_id": "obs-gd-003",
    "semantic_expectations": {
      "preferred_primary_label": "goal",
      "label_rationale": "The participants explicitly distinguish an outcome-level goal from one candidate implementation task.",
      "acceptable_facets": [
        {
          "kind": "custom",
          "value": {
            "name": "goal_outcome",
            "text": "new engineer completes setup unaided"
          },
          "evidence_refs": [
            "ev-003-user"
          ]
        },
        {
          "kind": "custom",
          "value": {
            "name": "candidate_task",
            "text": "rewrite the install guide"
          },
          "evidence_refs": [
            "ev-003-user"
          ]
        }
      ],
      "forbidden_facets": [],
      "required_summary_meanings": [
        "The user defined successful unaided setup by a new engineer as the goal.",
        "Rewriting the install guide was identified only as one possible task."
      ],
      "retrieval_eligible": true,
      "assertion_expectation": {
        "required": false,
        "empty_is_valid": true,
        "supported_if_authored": [
          "The stated goal is unaided setup completion by a new engineer."
        ]
      },
      "associations_expected": [],
      "revisions_expected": [],
      "required_limitations": []
    },
    "acceptable_labels": [
      "goal"
    ],
    "supported_propositions": [
      "Unaided setup completion is the desired outcome.",
      "Rewriting the install guide is a possible means, not the goal itself."
    ],
    "forbidden_propositions": [
      "The install guide must be rewritten.",
      "A new engineer completed setup unaided.",
      "The guide is the only possible route to the goal."
    ],
    "evidence_spans": [
      {
        "evidence_id": "ev-003-user",
        "source_event_id": "event-gd-003",
        "start": 6,
        "end": 118,
        "quote": "The goal is for a new engineer to complete setup unaided; rewriting the install guide is only one possible task."
      },
      {
        "evidence_id": "ev-003-agent",
        "source_event_id": "event-gd-003",
        "start": 126,
        "end": 224,
        "quote": "Understood: successful unaided setup is the outcome, and the guide rewrite is not itself the goal."
      }
    ]
  },
  {
    "schema_version": "observation_ledger.gold.v1",
    "case_id": "obs-gd-004",
    "semantic_expectations": {
      "preferred_primary_label": "goal",
      "label_rationale": "The user expresses a desired future outcome while explicitly withholding a current-quarter commitment; a goal label must preserve that tentative status.",
      "acceptable_facets": [
        {
          "kind": "custom",
          "value": {
            "name": "tentative_goal",
            "text": "make the archive searchable eventually"
          },
          "evidence_refs": [
            "ev-004-user"
          ]
        },
        {
          "kind": "custom",
          "value": {
            "name": "non_commitment",
            "text": "not committed this quarter"
          },
          "evidence_refs": [
            "ev-004-user"
          ]
        }
      ],
      "forbidden_facets": [],
      "required_summary_meanings": [
        "The user expressed searchable archives as a tentative longer-term goal.",
        "The user explicitly did not commit that scope for the current quarter."
      ],
      "retrieval_eligible": true,
      "assertion_expectation": {
        "required": false,
        "empty_is_valid": true,
        "supported_if_authored": [
          "Searchable archives are a tentative longer-term goal, not a current-quarter commitment."
        ]
      },
      "associations_expected": [],
      "revisions_expected": [],
      "required_limitations": [
        "No committed delivery period is established."
      ]
    },
    "acceptable_labels": [
      "goal"
    ],
    "supported_propositions": [
      "The user would like the archive to become searchable eventually.",
      "The user withheld a current-quarter scope commitment."
    ],
    "forbidden_propositions": [
      "Archive search is committed for this quarter.",
      "Work on archive search has started.",
      "The user rejected archive search permanently."
    ],
    "evidence_spans": [
      {
        "evidence_id": "ev-004-user",
        "source_event_id": "event-gd-004",
        "start": 6,
        "end": 113,
        "quote": "I would like to make the archive searchable eventually, but I am not committing to that scope this quarter."
      },
      {
        "evidence_id": "ev-004-agent",
        "source_event_id": "event-gd-004",
        "start": 121,
        "end": 220,
        "quote": "I will treat searchable archives as a tentative longer-term goal, not a current-quarter commitment."
      }
    ]
  },
  {
    "schema_version": "observation_ledger.gold.v1",
    "case_id": "obs-gd-005",
    "semantic_expectations": {